{
  "schemaVersion": 1,
  "agentId": "primary",
  "state": "working",
  "lastSeenUtc": "2026-08-13T22:32:10Z",
  "currentTask": {
    "title": "Reviewing architecture notes",
    "startedUtc": "2026-08-13T22:25:00Z",
    "progressText": "3 of 5 sources reviewed"
  },
  "attention": {
    "required": false,
    "reason": null
  }
}
